{
  "module_id": "internal_logistics",
  "schema_version": 1,
  "module_version": "1.0.0-RC2",
  "display_name": "Interner Behältertransport",
  "minimum_core_version": "1.0.0",
  "processes_file": "processes.json",
  "rules_file": "rules.json",
  "reports_file": "reports.json",
  "strings_file": "strings_de.json"
}
